{
  "schema": "edgp.license.report.v1",
  "ecosystem": "npm",
  "root": "demo-app==1.0.0",
  "policy": {
    "deniedLicenses": ["WTFPL"]
  },
  "summary": {
    "packages": 2,
    "licensedPackages": 1,
    "missingLicenses": 1,
    "distinctLicenses": 1,
    "deniedFindings": 1
  },
  "licenses": [
    {
      "license": "WTFPL",
      "packages": 1
    }
  ],
  "findings": [
    {
      "package": "left-pad==1.3.0",
      "license": "WTFPL",
      "matchedDeniedLicenses": ["WTFPL"],
      "metadata": {
        "component_type": "library",
        "ecosystem": "npm",
        "license": "WTFPL",
        "purl": "pkg:npm/left-pad@1.3.0"
      }
    }
  ],
  "missingLicenses": [
    {
      "package": "demo-app==1.0.0",
      "metadata": {
        "component_type": "library",
        "ecosystem": "npm",
        "purl": "pkg:npm/demo-app@1.0.0"
      }
    }
  ]
}
